{
  "$schema": "https://example.invalid/ai-migration-framework/schemas/exception.schema.json",
  "schema_version": "2.0",
  "id": "EXC-0001",
  "category": "dead-code",
  "status": "approved",
  "scope": ["SRC-0005"],
  "rationale": "Link map and runtime characterization show the report generator is unreachable.",
  "impact": "The obsolete report is not present in the target.",
  "mitigation": "Retain source tag and inventory evidence through decommission approval.",
  "approvals": ["product-owner", "migration-owner"],
  "expires_at": null
}
